{
  "$schema": "../../../schema/walkthrough.schema.json",
  "info": {
    "title": "Spatial Separation Between Buildings",
    "subtitle": "Volume II - 9.10.14.1-4",
    "description": "Calculations for size/number of doors/windows in a wall facing another building",
    "startingSectionId": "1_9_10_14",
    "walkthroughTitle": "9.10.14.1-4 Spatial Separation Between Buildings"
  },
  "sections": {
    "1_9_10_14": {
      "sectionTitle": "9.10.14. Spatial Separation Between Buildings",
      "sectionQuestions": [
        "P33", "P34", "P35", "P36", "P37", "P38"
      ]
    }
  },
  "questions": {
    "P33": {
      "walkthroughItemType": "numberFloat",
      "questionText": "What is the area of the selected <defined-term>exposing building face</defined-term> <span aria-label='in meters squared'>(m<sup>2</sup>)</span>?",
      "questionSubtext": "<p>Answer all following questions based on one selected exposing building face that has not been evaluated yet. (It is recommended to track which exposing building faces have been evaluated.)</p><p>The area of an exposing building face is calculated by taking the exterior wall area that faces in one direction on any side of a <defined-term>building</defined-term> and calculating the total area of that exterior face from the finished ground level to the uppermost ceiling. <building-code reference='v2-db-9.10.14.2.(1)'>Sentence 9.10.14.2.(1)</building-code></p><p>Alternatively, an exterior wall may be divided into smaller exposing building faces that can be calculated separately in a building that is divided into <defined-term override-term='fire compartment'>fire compartments</defined-term> that are separated from the remainder of the building by <defined-term override-term='fire separation'>fire separations</defined-term> with <defined-term override-term='fire-resistance rating'>fire-resistance ratings</defined-term> not less than 45 min. In this circumstance the area of each exposing building face for each fire compartment is based on the area of the exposing wall of that fire compartment and calculated separately from other fire compartments. <building-code reference='v2-db-9.10.14.2.(4)'>Sentence 9.10.14.2.(4)</building-code></p>",
      "questionCodeReference": {
        "displayString": "Vol 2, Div B, Sentence 9.10.14.2",
        "codeNumber": "v2-db-9.10.14.2"
      },
      "placeholder": "Enter area",
      "unit": "m<sup>2</sup>",
      "nextNavigationLogic": [
        {
          "nextLogicType": "fallback",
          "nextNavigateTo": "P34"
        }
      ]
    },
    "P34": {
      "walkthroughItemType": "numberFloat",
      "questionText": "What is the <defined-term>limiting distance</defined-term> for the exterior wall for this <defined-term>fire compartment</defined-term> <span aria-label='in meters'>(m)</span>?",
      "questionSubtext": "<p>The location of the <defined-term>exposing building face</defined-term> shall be taken as a vertical plane located so that there are no <defined-term>unprotected openings</defined-term> between the vertical plane and the line to which the <defined-term>limiting distance</defined-term> is measured. <pdf-download-link named-dest='A-3.2.3.1.(4) Spatial Separation Design.'>See Note A-3.2.3.1.(4).</pdf-download-link>",
      "questionCodeReference": {
        "displayString": "Vol 2, Div B, Sentence 9.10.14.2.(2)",
        "codeNumber": "v2-db-9.10.14.2.(2)"
      },
      "placeholder": "Enter limiting distance",
      "unit": "m",
      "nextNavigationLogic": [
        {
          "nextLogicType": "fallback",
          "nextNavigateTo": "P34Editable"
        }
      ]
    },
    "P34Editable": {
      "walkthroughItemType": "variable",
      "variableToSet": {
        "variableType": "copy",
        "variableName": "P34Editable",
        "variableValue": "P34"
      },
      "nextNavigationLogic": [
        {
          "nextLogicType": "fallback",
          "nextNavigateTo": "P35"
        }
      ]
    },
    "P35": {
      "walkthroughItemType": "multiChoice",
      "questionText": "Is this compartment <defined-term>sprinklered</defined-term> per <pdf-download-link named-dest='3.2.5.12. Automatic Sprinkler Systems'>Article 3.2.5.12.</pdf-download-link>?",
      "questionCodeReference": {
        "displayString": "Vol 2, Div B, Subsection 9.10.14.",
        "codeNumber": "v2-db-9.10.14."
      },
      "possibleAnswers": [
        {
          "answerDisplayText": "Yes",
          "answerValue": "true"
        },
        {
          "answerDisplayText": "No",
          "answerValue": "false"
        }
      ],
      "nextNavigationLogic": [
        {
          "nextLogicType": "and",
          "valuesToCheck": [
            {
              "nextLogicType": "equal",
              "answerToCheck": "P35",
              "answerValue": "true"
            },
            {
              "nextLogicType": "lessThan",
              "answerToCheck": "P34",
              "answerValue": "1.2"
            }
          ],
          "nextNavigateTo": "R1_0"
        },
        {
          "nextLogicType": "and",
          "valuesToCheck": [
            {
              "nextLogicType": "equal",
              "answerToCheck": "P35",
              "answerValue": "true"
            },
            {
              "nextLogicType": "lessThan",
              "answerToCheck": "P34",
              "answerValue": "2"
            }
          ],
          "nextNavigateTo": "P10"
        },
        {
          "nextLogicType": "and",
          "valuesToCheck": [
            {
              "nextLogicType": "equal",
              "answerToCheck": "P35",
              "answerValue": "true"
            },
            {
              "nextLogicType": "or",
              "valuesToCheck": [
                {
                  "nextLogicType": "equal",
                  "answerToCheck": "P34",
                  "answerValue": "9"
                },
                {
                  "nextLogicType": "greaterThan",
                  "answerToCheck": "P34",
                  "answerValue": "9"
                }
              ]
            }
          ],
          "nextNavigateTo": "P37"
        },
        {
          "nextLogicType": "equal",
          "answerToCheck": "P35",
          "answerValue": "true",
          "nextNavigateTo": "P9T1"
        },
        {
          "nextLogicType": "fallback",
          "nextNavigateTo": "P36"
        }
      ]
    },
    "P36": {
      "walkthroughItemType": "multiChoice",
      "questionText": "Does the time from receipt of notification of a fire by the fire department until the first fire department vehicle arrives at the <defined-term>building</defined-term> exceed 10 min in 10% or more of all calls to this building?",
      "questionCodeReference": {
        "displayString": "Vol 2, Div B, Subsection 9.10.14.3.(1)",
        "codeNumber": "v2-db-9.10.14.3.(1)"
      },
      "possibleAnswers": [
        {
          "answerDisplayText": "Yes",
          "answerValue": "true"
        },
        {
          "answerDisplayText": "No",
          "answerValue": "false"
        }
      ],
      "nextNavigationLogic": [
        {
          "nextLogicType": "fallback",
          "nextNavigateTo": "P36P34Editable"
        }
      ]
    },
    "P36P34Editable": {
      "walkthroughItemType": "variable",
      "variableToSet": {
        "variableType": "number",
        "variableName": "P34Editable",
        "variableValue": [
          {
            "variableValueLogicType": "equals",
            "answerToCheck": "P36",
            "answerValue": "true",
            "variableValueToSetCalculation": {
              "answerToUse": "P34",
              "variableValueCalculationType": "divide",
              "calculationValueToUse": 2
            }
          },
          {
            "variableValueLogicType": "equals",
            "answerToCheck": "P36",
            "answerValue": "false",
            "variableValueToSetCalculation": {
              "answerToUse": "P34",
              "variableValueCalculationType": "divide",
              "calculationValueToUse": 1
            }
          }
        ]
      },
      "nextNavigationLogic": [
        {
          "nextLogicType": "lessThan",
          "answerToCheck": "P34Editable",
          "answerValue": "1.2",
          "nextNavigateTo": "R1_0"
        },
        {
          "nextLogicType": "lessThan",
          "answerToCheck": "P34Editable",
          "answerValue": "2",
          "nextNavigateTo": "P10"
        },
        {
          "nextLogicType": "or",
          "valuesToCheck": [
            {
              "nextLogicType": "equal",
              "answerToCheck": "P34Editable",
              "answerValue": "9"
            },
            {
              "nextLogicType": "greaterThan",
              "answerToCheck": "P34Editable",
              "answerValue": "9"
            }
          ],
          "nextNavigateTo": "P37"
        },
        {
          "nextLogicType": "fallback",
          "nextNavigateTo": "P9T1"
        }
      ]
    },
    "P10": {
      "walkthroughItemType": "variable",
      "variableToSet": {
        "variableType": "number",
        "variableName": "P10",
        "variableValue": [
          {
            "variableValueLogicType": "fallback",
            "variableValueToSetCalculation": {
              "answerToUse": "P34Editable",
              "variableValueCalculationType": "square"
            }
          }
        ]
      },
      "nextNavigationLogic": [
        {
          "nextLogicType": "fallback",
          "nextNavigateTo": "P9T1"
        }
      ]
    },
    "P37": {
      "walkthroughItemType": "multiChoice",
      "questionText": "Does this <defined-term>fire compartment</defined-term> face a <defined-term>street</defined-term> and is at street level?",
      "questionCodeReference": {
        "displayString": "Vol 2, Div B, Subsection 9.10.14.4.(9)",
        "codeNumber": "v2-db-9.10.14.4.(9)"
      },